{
  "$schema_version": 1,
  "$format": {
    "why_this_block_exists": [
      "$format documents the workflow format in the same file people edit.",
      "The runner ignores this block; behavior is controlled by `inputs`, `globals`,",
      "`defaults`, `steps`, `completion`, and `persistence`."
    ],
    "prompt_authoring": [
      "Use prompt arrays for shipped workflows so prompts remain readable and diffable.",
      "The loader joins array entries with newline characters.",
      "`prompt_file` is supported for local/operator workflows and resolves relative to",
      "the workflow JSON file. This shipped workflow keeps prompts inline on purpose."
    ],
    "globals": [
      "`globals` is a reusable prompt-fragment namespace.",
      "Each entry is included only when a step lists it in `include` using",
      "`{{globals.<name>}}`.",
      "This review workflow uses globals for the invariant review policy and the exact",
      "Finding schema every lens must return, so all parallel calls share the same contract."
    ],
    "defaults": [
      "`defaults` fills missing step fields. This workflow defaults to slow/review",
      "with one eval attempt.",
      "The single investigate step repeats the defaults explicitly where clarity matters.",
      "Step fields override defaults; unset fields inherit them."
    ],
    "ordering_and_parallelism": [
      "`depends_on` controls step ordering. This workflow has one logical step, so there",
      "is no inter-step sequence to manage.",
      "`lenses` is the parallelism primitive: the runner invokes the same prompt once per",
      "lens concurrently, binding fields as `{{lens.id}}` and `{{lens.investigate}}`.",
      "`aggregate: consolidate` runs an N+1 merge call after all lenses finish, using the",
      "`consolidate.prompt` rules to deduplicate and rank findings."
    ],
    "failure_and_evals": [
      "Review does not use workflow-local eval retry for followups.",
      "A lensed review turn completes after gather, parallel slow-agent lenses, and",
      "consolidation. Typed followups remain in the step output.",
      "The outer kres task reaper then sends those followups to the todo agent, which",
      "deduplicates and prioritizes them into the next review todo. That next todo runs",
      "as a fresh review task through the same JSON-defined lenses.",
      "This keeps context bounded and preserves the golden review loop: slow agents",
      "produce Findings plus followups, the todo agent chooses the next frontier, and",
      "the scheduler continues until the turn cap or followup exhaustion.",
      "The only local eval guard is `analysis != ''`, which retries an empty/malformed",
      "review response a few times. Followups never make that eval fail.",
      "Completion fails only on explicit workflow exit_failure."
    ],
    "review_shape": [
      "Each lens performs independent deep review for one class of bug.",
      "The consolidator merges duplicate root causes and drops non-bugs.",
      "Unresolved concrete suspicions become followups, not terminal workflow failures.",
      "The output is the same Finding record shape used by the rest of kres, not ad hoc",
      "review notes."
    ]
  },
  "id": "review",
  "title": "Deep bug review of a target",
  "description": "Run independent slow-agent review lenses in parallel, then consolidate and rank concrete findings.",
  "inputs": {
    "target": {
      "type": "string",
      "required": true,
      "derive": {
        "target_is_commit": {
          "type": "boolean",
          "rule": "git_ref_or_range"
        }
      },
      "description": "A file path, function name, commit ref (e.g. HEAD), diff, or code snippet supplied by the operator. Commit refs and ranges mean review the changes introduced by that ref/range, not the entire repository tree."
    }
  },
  "skills": [
    "auto"
  ],
  "globals": {
    "review_intro": "Find every concrete correctness bug you can involving the target. Focus on bugs that can be triggered by using that target, including chains of events that pass through unchanged callers, callees, callbacks, helpers, and setup/registration code. Do not stop after the first issue. Each lens must exhaustively enumerate its own class of defects: list every distinct defect or strong suspect it can support, and keep driving followups when more source/type/history/callers/API context would materially improve confidence. Do not report style issues or vague design concerns as findings. Missing context is not itself a finding, but it is normal review frontier: emit typed followups for the exact evidence needed. A concrete unresolved suspicion is not a clean result: either prove it as a Finding, keep it as a strong-suspect Finding with open_questions and matching followups, disprove it in analysis with cited evidence, or emit a followup for the missing source/type/history needed. A clean result is valid only when the lens is confident no bugs of its class remain in scope for this target.",
    "contract_trace": "For commit/range reviews, the audit target is the semantic change, not just the edited lines. Identify what contract the patch changed: object layout, type/union interpretation, enum selector, ops table, callback target, helper family, allocation/freeing rule, lifetime/refcount rule, lock rule, accounting/visibility contract, or ordering guarantee. Then trace the unchanged code paths that use that contract: readers, writers, callers, callees, callbacks, registration/setup sites, shared helpers, and history when needed. Representation/API migrations are especially dangerous because the changed code may allocate, advertise, or update the new representation while unchanged paths still use the old representation. Negative coverage claims require concrete evidence: do not say no remaining users, all callers updated, old path unreachable, or sole reader/writer unless source/type/search/callgraph/history context proves it. Do not hardcode subsystem rules; follow the changed contract. If this context is missing, emit followups instead of declaring the lens clean.",
    "finding_schema": "Return full Finding records using the tool schema, not simplified review notes. Required per finding: id, title, severity (low|medium|high), status (active), relevant_symbols [{name, filename, line, definition}], relevant_file_sections [{filename, line_start, line_end, content}] when needed, summary, reproducer_sketch, impact. Optional: mechanism_detail, fix_sketch, open_questions, related_finding_ids. Keep embedded source bodies minimal but sufficient to prove the bug. A strong suspect may be a Finding when it has a concrete code path, trigger, and impact; put remaining proof gaps in open_questions and also emit followups for the exact missing evidence. Return JSON as {\"analysis\": \"brief lens narrative\", \"findings\": [<Finding>, ...], \"followups\": [<Followup>, ...]}. Use {\"analysis\": \"what was checked\", \"findings\": [], \"followups\": []} when clean. Followups use {\"type\": \"survey|read|source|type|git|grep|callers|question\", \"name\": \"specific request\", \"reason\": \"why this is needed to prove or disprove the concrete suspicion\"}. For a named source-file target, bootstrap supplies the ranked function inventory before goal and plan creation. Use it to prioritize targeted source or ranges; do not repeat the survey. Return exactly one raw JSON object. Do not return Markdown: no Markdown headings, prose preamble, code fences, backticks, or trailing commentary."
  },
  "defaults": {
    "agent": "slow",
    "mode": "review",
    "max_eval_attempts": 1
  },
  "steps": [
    {
      "id": "investigate",
      "title": "Investigate the target through independent lenses",
      "agent": "slow",
      "mode": "review",
      "actions": [
        "read",
        "source",
        "type",
        "git",
        "grep",
        "callers"
      ],
      "include": [
        "{{globals.review_intro}}",
        "{{globals.contract_trace}}",
        "{{globals.finding_schema}}"
      ],
      "prompt": [
        "Apply the {{lens.id}} lens to the target.",
        "",
        "TARGET: {{workflow.target}}",
        "LENS: {{lens.id}}",
        "",
        "{{lens.investigate}}",
        "",
        "Gather the source, type definitions, callers, and history needed to make file:line-cited claims.",
        "If TARGET is a git ref such as HEAD, a commit SHA, or a range, start from the",
        "target diff/stat and changed files. Do not enumerate or audit the whole",
        "repository unless the operator explicitly asks for a whole-tree audit.",
        "",
        "Find every bug you can involving the target. Do not stop after the first finding.",
        "Each lens must exhaustively enumerate issues in its own bug class. A lens that",
        "reports no finding is acceptable only when it is confident no bug of that class",
        "remains in scope for the target. If that confidence depends on more source,",
        "callers, history, or API semantics, emit typed followups instead of declaring",
        "the pass clean. Followups are the normal next frontier for review turns.",
        "",
        "For commit/range reviews, trace the semantic contracts changed by the diff. Do not",
        "only inspect edited callsites. If the target changes an object layout, type/union",
        "interpretation, enum selector, ops table, callback target, helper family, allocation",
        "or freeing rule, lifetime/refcount rule, lock rule, accounting/visibility contract,",
        "or ordering guarantee, inspect the unchanged chains that can still use the old",
        "contract. That means callers, callees, callbacks, shared helpers, registration/setup",
        "sites, readers, writers, and git history when needed. A migration is not clean until",
        "old-contract paths involving the same object or behavior have been checked or requested",
        "as followups.",
        "",